<?xml version="1.0" encoding="UTF-8"?>

<!--
    Document   : Users.xml
    Created on : June 6, 2013, 5:38 AM
    Author     : Quaikiet
    Description:
        Purpose of the document follows.
-->

<users  xmlns:xsi='http://www.w3.org/2001/XMLSchema-instance'
   xmlns='http://xml.netbeans.org/schema/users'
   xsi:schemaLocation='http://xml.netbeans.org/schema/users ../schema/users.xsd'>
    <User password="asd123456">
        <UserId>1</UserId>
        <UserName>asd</UserName>
        <Email>asd</Email>
        <FullName>asd</FullName>
        <Role>1</Role>
        <Phone>asdad</Phone>
    </User>
    <User password="zxc123456">
        <UserId>1</UserId>
        <UserName>asd</UserName>
        <Email>asd</Email>
        <FullName>asd</FullName>
        <Role>1</Role>
        <Phone>asdad</Phone>
    </User>
   
</users>
